{"actor":{"actor_type":"AGENT","admission_id":"PRE_FORMAL_ADMISSION_BOOTSTRAP","capability_profile_sha256":null,"model":"GPT-5.6 Sol","provider":"OPENAI","rank_profile":null,"role":"AXIOM_EPISTEMIC_AND_GITHUB_IMPLEMENTATION_AGENT","session_id":"CURRENT_AXIOM_GITHUB_IMPLEMENTATION_SESSION"},"after":{"bytes":2147,"exists":true,"path":"schema/r5/agent-governance/nexus-agent-capability-profile-v1.schema.json","sha256":"edca1ef904eeaaf5282b5dd091640e6905f1eaa7acbf8a9b0518ac268c9137af"},"artifact_class":"SCHEMA","before":{"bytes":null,"exists":false,"path":null,"sha256":null},"claim_ceiling":"C1","digest_domain":"SHA256_RAW_BYTES_V1","event_id":"pr13-backfill-8a985ad0-005","git":{"base_commit":"7c93e73c0e39a6604b4c00996b5b04c3ef413b4e","pr_number":13,"repository":"nexusomegac27/NEXUS-OMEGA-EVIDENCE","result_commit":"8a985ad0e06ec33ca93502d930b7956d06ddcb76"},"operation":"CREATE","reason":"BACKFILL=TRUE; BACKFILL_BASIS=EXACT_GIT_BYTES_AND_OPERATOR_AXIOM_SESSION_EVIDENCE; CURSOR_BACKFILL_CAUSE=THIS_ORDER; CREATION_CAUSE=OPERATOR_CURRENT_REQUEST_VIA_AXIOM","recorded_at_utc":"2026-09-02T00:01:45Z","schema_version":"1.0.0","task":{"order_id":"NEXUS_OMEGA_CURSOR_QWEN_LAYER1_R1_FULL_MEASUREMENT_CHRONOLOGY_FILE_EVENT_GITHUB_ORDER_20260902_R0","order_sha256":"e00987e80a7eed8c135f8ba0b38b608b3a7d5638c6dda8bba2493063ba5b10fb","parent_event_id":null},"validation":{"independent_validation":"CURSOR_PRAXIS_BOOTSTRAP_20260902_R0","producer_self_report":null}}