{"actor":{"actor_type":"AGENT","admission_id":"PRE_FORMAL_ADMISSION_BOOTSTRAP","capability_profile_sha256":null,"model":"GPT-5.6 Sol","provider":"OPENAI","rank_profile":null,"role":"AXIOM_EPISTEMIC_AND_GITHUB_IMPLEMENTATION_AGENT","session_id":"CURRENT_AXIOM_GITHUB_IMPLEMENTATION_SESSION"},"after":{"bytes":1279,"exists":true,"path":"tests/r5/test_file_protocol.py","sha256":"558035944cbb20637ee9da49534ecac599f9479c1db676329164cc345828bae3"},"artifact_class":"TEST","before":{"bytes":1079,"exists":true,"path":"tests/r5/test_file_protocol.py","sha256":"65cc221acc206b6d6087b763ee61c28836b8f564441599311dd873831530f617"},"claim_ceiling":"C1","digest_domain":"SHA256_RAW_BYTES_V1","event_id":"pr13-backfill-ee537bcb-016","git":{"base_commit":"338547fdaf896de4625f6091e9fa5e78cef5e1d8","pr_number":13,"repository":"nexusomegac27/NEXUS-OMEGA-EVIDENCE","result_commit":"ee537bcb60294126be67882ff384daa3326dc6f8"},"operation":"MODIFY","reason":"BACKFILL=TRUE; BACKFILL_BASIS=EXACT_GIT_BYTES_AND_OPERATOR_AXIOM_SESSION_EVIDENCE; CURSOR_BACKFILL_CAUSE=THIS_ORDER; CREATION_CAUSE=OPERATOR_CURRENT_REQUEST_VIA_AXIOM","recorded_at_utc":"2026-09-02T00:01:45Z","schema_version":"1.0.0","task":{"order_id":"NEXUS_OMEGA_CURSOR_QWEN_LAYER1_R1_FULL_MEASUREMENT_CHRONOLOGY_FILE_EVENT_GITHUB_ORDER_20260902_R0","order_sha256":"e00987e80a7eed8c135f8ba0b38b608b3a7d5638c6dda8bba2493063ba5b10fb","parent_event_id":null},"validation":{"independent_validation":"CURSOR_PRAXIS_BOOTSTRAP_20260902_R0","producer_self_report":null}}