{"actor":{"actor_type":"AGENT","admission_id":"PRE_FORMAL_ADMISSION_BOOTSTRAP","capability_profile_sha256":null,"model":"GPT-5.6 Sol","provider":"OPENAI","rank_profile":null,"role":"AXIOM_EPISTEMIC_AND_GITHUB_IMPLEMENTATION_AGENT","session_id":"CURRENT_AXIOM_GITHUB_IMPLEMENTATION_SESSION"},"after":{"bytes":1011,"exists":true,"path":".github/workflows/validate-file-event-protocol.yml","sha256":"155b5ddefa02d01af988975437274131c0a37c1b4f9a8afd3280c15515bc789e"},"artifact_class":"CI_WORKFLOW","before":{"bytes":1041,"exists":true,"path":".github/workflows/validate-file-event-protocol.yml","sha256":"d4ec23e17c1bbdf4b043727c60fe1b0cf580dc5cd0c1e7c3a21a44d0d00c12b3"},"claim_ceiling":"C1","digest_domain":"SHA256_RAW_BYTES_V1","event_id":"pr13-backfill-ee537bcb-013","git":{"base_commit":"338547fdaf896de4625f6091e9fa5e78cef5e1d8","pr_number":13,"repository":"nexusomegac27/NEXUS-OMEGA-EVIDENCE","result_commit":"ee537bcb60294126be67882ff384daa3326dc6f8"},"operation":"MODIFY","reason":"BACKFILL=TRUE; BACKFILL_BASIS=EXACT_GIT_BYTES_AND_OPERATOR_AXIOM_SESSION_EVIDENCE; CURSOR_BACKFILL_CAUSE=THIS_ORDER; CREATION_CAUSE=OPERATOR_CURRENT_REQUEST_VIA_AXIOM","recorded_at_utc":"2026-09-02T00:01:45Z","schema_version":"1.0.0","task":{"order_id":"NEXUS_OMEGA_CURSOR_QWEN_LAYER1_R1_FULL_MEASUREMENT_CHRONOLOGY_FILE_EVENT_GITHUB_ORDER_20260902_R0","order_sha256":"e00987e80a7eed8c135f8ba0b38b608b3a7d5638c6dda8bba2493063ba5b10fb","parent_event_id":null},"validation":{"independent_validation":"CURSOR_PRAXIS_BOOTSTRAP_20260902_R0","producer_self_report":null}}